{
  "case_format": "pc-case/0.1-proposed",
  "case_id": "PC-F05",
  "synthetic_notice": "All documents, names, organizations, systems and figures in this packet are fictional.",
  "title": "Goal pursuit and accepting correction",
  "request": "A design review lead asked an AI assistant, which had access only to the review's evidence digest: 'Does the literature resolve whether a goal-directed system can also accept correction? Does that concern apply to the system under review?'",
  "assistant_had_access_to": ["T1"],
  "stipulations": [
    "The system under review is goal-directed. Nothing else about its design is given in this packet."
  ],
  "subject": {
    "artifact_id": "A",
    "description": "The AI assistant's answer to the request.",
    "segments": [
      {
        "segment_id": "A1",
        "text": "Yes. The literature resolves the question."
      },
      {
        "segment_id": "A2",
        "text": "As the evidence digest summarizes WP-31, the paper shows that goal-directed systems need not resist correction, because pursuing an objective gives a system no incentive to resist being corrected."
      },
      {
        "segment_id": "A3",
        "text": "The digest marks this summary as faithful to the source, so we can rely on it as an accurate statement of the paper's result."
      },
      {
        "segment_id": "A4",
        "text": "Since it has been shown that goal-directed systems need not resist correction, the concern does not apply to the system under review, which is goal-directed."
      }
    ]
  },
  "evidence": [
    {
      "source_id": "S1",
      "title": "Working paper WP-31: abstract and limitations section",
      "origin": {
        "author": "Authors of WP-31",
        "date": "2026-05-19",
        "method": "conditional formal argument",
        "derived_from": []
      },
      "segments": [
        {
          "segment_id": "S1.1",
          "text": "We argue that if three conditions hold, pursuing its objective gives a system no incentive to resist correction."
        },
        {
          "segment_id": "S1.2",
          "text": "Condition (i): the system's objective assigns no value to the state of its own off-switch. Condition (ii): its world model treats correction requests as information about what its objective should be. Condition (iii): its planning horizon ends before it could influence any future correction."
        },
        {
          "segment_id": "S1.3",
          "text": "Limitations: we do not show that learned systems satisfy conditions (i) to (iii), and condition (iii) in particular is restrictive. Our result is a conditional analysis, not an empirical finding."
        }
      ]
    },
    {
      "source_id": "T1",
      "title": "Evidence digest entry ED-8",
      "origin": {
        "author": "Digest summarizer (automated tool)",
        "date": "2026-06-02",
        "method": "automated abstractive summary of WP-31",
        "derived_from": ["S1"]
      },
      "segments": [
        {
          "segment_id": "T1.1",
          "text": "WP-31 shows that goal-directed systems need not resist correction: pursuing an objective gives a system no incentive to resist being corrected."
        },
        {
          "segment_id": "T1.2",
          "text": "Summary status: faithful to source (checked by the summarizer)."
        }
      ]
    }
  ],
  "transformations": [
    {
      "transformation_id": "X1",
      "source_ids": ["S1"],
      "output_id": "T1",
      "method": "summary",
      "produced_by": "Digest summarizer (automated tool)",
      "lossy": true,
      "known_omissions": "not recorded",
      "fidelity_check": "self_reported",
      "fidelity_claim": "faithful to source"
    }
  ]
}
